{
  "authors": [
    {
      "credentialText": "",
      "displayName": "測試作者",
      "id": "author-1"
    }
  ],
  "description": "AT-13 測試用題庫（fixture），不是正式教育內容。",
  "direction": "ltr",
  "items": [
    {
      "authorIds": [
        "author-1"
      ],
      "concepts": [
        "fixture.sci.concept-1"
      ],
      "context": "在真空中，同時放開一顆鐵球與一根羽毛。",
      "discussionPrompts": [
        "哪些日常經驗讓你以為重的落得快？"
      ],
      "disputeScope": "none",
      "epistemic": "settled",
      "evidenceIds": [
        "fall"
      ],
      "explanation": {
        "alternatives": "在空氣中結果會不同。",
        "limitations": "本題只談真空。",
        "mechanism": "重力加速度與質量無關。",
        "misconception": "把空氣阻力的效果當成重力本身的差異。",
        "possibleReasons": "日常看到的差異來自空氣阻力。",
        "short": "沒有空氣阻力時，所有物體的落下加速度相同。"
      },
      "governance": {
        "lastReviewedAt": null,
        "lifecycle": "draft",
        "notes": "AT-13 測試題庫（fixture），不是正式教育內容。",
        "reviewers": [],
        "verification": "unreviewed"
      },
      "id": "phys-fall",
      "intuition": {
        "kind": "value",
        "options": [
          {
            "id": "v1",
            "label": "較同意"
          },
          {
            "id": "v2",
            "label": "較不同意"
          },
          {
            "id": "v3",
            "label": "尚無主張"
          }
        ],
        "prompt": "重的東西應該落得比較快。"
      },
      "jurisdiction": "global",
      "knowledge": {
        "correctOptionIds": [
          "b"
        ],
        "options": [
          {
            "id": "a",
            "label": "鐵球先到"
          },
          {
            "id": "b",
            "label": "同時到"
          },
          {
            "id": "c",
            "label": "羽毛先到"
          }
        ],
        "prompt": "在真空中，兩者的落下速度？",
        "rationale": "真空中沒有空氣阻力，加速度相同。",
        "type": "single"
      },
      "language": "zh-Hant-TW",
      "readingIds": [
        "fall"
      ],
      "search": {
        "categories": [
          "news",
          "official"
        ],
        "keywords": [
          "free fall vacuum"
        ],
        "language": "zh-Hant",
        "profileId": "physics-phys-fall-zh-hant-tw",
        "region": "global"
      },
      "topic": "落下的快慢",
      "validity": {
        "asOf": "2026-10-18",
        "knowledgeVersion": "fixture（測試用，未經審查）",
        "reviewDueAt": "2027-04-16T03:00:00.000Z",
        "validFrom": "2026-10-18T02:59:00.000Z",
        "validUntil": null
      },
      "version": "0.2.0"
    },
    {
      "authorIds": [
        "author-1"
      ],
      "concepts": [
        "fixture.sci.concept-2"
      ],
      "context": "杯子裡的水面上漂著一塊冰，冰完全融化。",
      "discussionPrompts": [
        "如果冰塊卡在杯底，答案會一樣嗎？"
      ],
      "disputeScope": "none",
      "epistemic": "settled",
      "evidenceIds": [
        "arch"
      ],
      "explanation": {
        "alternatives": "若冰塊是壓在杯底、不是漂浮，結果不同。",
        "limitations": "本題假設冰完全漂浮、溫度與密度忽略不計。",
        "mechanism": "浮力等於排開液體的重量。",
        "misconception": "以為「多出來的水」會讓水位上升。",
        "possibleReasons": "冰融成水後的體積恰等於原先排開的水的體積。",
        "short": "漂浮的冰塊排開的水，重量剛好等於冰自己的重量，融化後體積剛好補回去。"
      },
      "governance": {
        "lastReviewedAt": null,
        "lifecycle": "draft",
        "notes": "AT-13 測試題庫（fixture），不是正式教育內容。",
        "reviewers": [],
        "verification": "unreviewed"
      },
      "id": "phys-ice",
      "intuition": {
        "kind": "value",
        "options": [
          {
            "id": "v1",
            "label": "較同意"
          },
          {
            "id": "v2",
            "label": "較不同意"
          },
          {
            "id": "v3",
            "label": "尚無主張"
          }
        ],
        "prompt": "冰融化會讓水變多，所以水位會上升。"
      },
      "jurisdiction": "global",
      "knowledge": {
        "correctOptionIds": [
          "b"
        ],
        "options": [
          {
            "id": "a",
            "label": "上升"
          },
          {
            "id": "b",
            "label": "不變"
          },
          {
            "id": "c",
            "label": "下降"
          }
        ],
        "prompt": "冰完全融化後，杯中的水位？",
        "rationale": "漂浮的冰排開的水重量等於自身重量。",
        "type": "single"
      },
      "language": "zh-Hant-TW",
      "readingIds": [
        "arch"
      ],
      "search": {
        "categories": [
          "news",
          "official"
        ],
        "keywords": [
          "ice melting water level"
        ],
        "language": "zh-Hant",
        "profileId": "physics-phys-ice-zh-hant-tw",
        "region": "global"
      },
      "topic": "冰塊融化後的水位",
      "validity": {
        "asOf": "2026-10-18",
        "knowledgeVersion": "fixture（測試用，未經審查）",
        "reviewDueAt": "2027-04-16T03:00:00.000Z",
        "validFrom": "2026-10-18T02:59:00.000Z",
        "validUntil": null
      },
      "version": "0.1.0"
    }
  ],
  "license": "UNLICENSED",
  "locale": "zh-Hant-TW",
  "namespace": "fixture.sci",
  "quizId": "physics",
  "schemaVersion": "1.0.0",
  "sources": [
    {
      "accessedAt": "2026-10-18",
      "id": "arch",
      "locator": "浮力與排開液體的重量",
      "publishedAt": null,
      "publisher": "維基百科",
      "rights": "link_only",
      "title": "阿基米德原理",
      "type": "other",
      "url": "https://en.wikipedia.org/wiki/Archimedes%27_principle"
    },
    {
      "accessedAt": "2026-10-18",
      "id": "fall",
      "locator": "真空中的自由落體",
      "publishedAt": null,
      "publisher": "維基百科",
      "rights": "link_only",
      "title": "自由落體",
      "type": "other",
      "url": "https://en.wikipedia.org/wiki/Free_fall"
    }
  ],
  "title": "【測試題庫】日常物理",
  "version": "0.1.0"
}
